{
  "metadata": {
    "package_name": "com.revrag.sampleapp",
    "timestamp": "2026-09-18 04:00:14 UTC",
    "exploration_engine": "RevRag-ZeroTouch-v1.0",
    "total_screens_discovered": 5,
    "total_transitions_logged": 16,
    "pack_size_kb": 25.8,
    "raw_tree_equivalent_kb": 6.97,
    "compression_ratio": "95.4%"
  },
  "design_system": {
    "palette": {
      "primary_accent": "#6366f1",
      "secondary_accent": "#6669f9",
      "background": "#12141d",
      "surface": "#1a202c",
      "text_primary": "#F8FAFC",
      "text_secondary": "#94A3B8",
      "is_dark_mode": true,
      "palette_hex_list": [
        "#12141d",
        "#1a202c",
        "#1a1d29",
        "#6366f1",
        "#161b27",
        "#1f2436",
        "#12141c",
        "#1a1e2a"
      ]
    },
    "typography": {
      "display_title_height_dp": 32,
      "heading_height_dp": 22,
      "body_text_height_dp": 16,
      "caption_height_dp": 12,
      "font_family_recommendation": "Inter, -apple-system, Roboto, sans-serif"
    },
    "spacing": {
      "base_grid_unit_dp": 8,
      "screen_padding_horizontal_dp": 24,
      "component_gap_vertical_dp": 12,
      "border_radius_dp": 12
    },
    "tone_of_voice": "Action-Oriented & Direct | Friendly & Inviting",
    "recurring_components": [
      {
        "component_type": "TextView",
        "count_across_app": 13,
        "sample_resource_ids": [
          "tv_product_price",
          "tv_product_title",
          "tv_detail_title",
          "tv_title"
        ],
        "typical_bounds_ratio": 1.0
      },
      {
        "component_type": "Button",
        "count_across_app": 5,
        "sample_resource_ids": [
          "btn_logout",
          "btn_add_to_cart",
          "btn_get_started",
          "btn_login_submit"
        ],
        "typical_bounds_ratio": 1.0
      },
      {
        "component_type": "FrameLayout",
        "count_across_app": 3,
        "sample_resource_ids": [
          "nav_cart",
          "nav_profile",
          "nav_home"
        ],
        "typical_bounds_ratio": 1.0
      },
      {
        "component_type": "EditText",
        "count_across_app": 3,
        "sample_resource_ids": [
          "edit_otp",
          "edit_phone",
          "edit_search_bar"
        ],
        "typical_bounds_ratio": 1.0
      },
      {
        "component_type": "CardView",
        "count_across_app": 2,
        "sample_resource_ids": [
          "card_product_1",
          "card_product_2"
        ],
        "typical_bounds_ratio": 1.0
      },
      {
        "component_type": "ImageButton",
        "count_across_app": 2,
        "sample_resource_ids": [
          "btn_back_profile",
          "btn_back"
        ],
        "typical_bounds_ratio": 1.0
      },
      {
        "component_type": "ImageView",
        "count_across_app": 1,
        "sample_resource_ids": [
          "iv_logo"
        ],
        "typical_bounds_ratio": 1.0
      }
    ]
  },
  "screen_graph": {
    "nodes": [
      {
        "fingerprint": "scr_5b353a89a14fed38",
        "screen_name": "Splash",
        "category": "onboarding",
        "purpose": "Introduces new users to the features and entry flow of Splash.",
        "elements_count": 5,
        "activity_name": "com.revrag.sampleapp.SplashActivity"
      },
      {
        "fingerprint": "scr_c0c416f5fba65fa1",
        "screen_name": "Welcome Back - Login",
        "category": "authentication",
        "purpose": "Authenticates the user into the application using mobile, email, or credentials (Welcome Back - Login).",
        "elements_count": 6,
        "activity_name": "com.revrag.sampleapp.LoginActivity"
      },
      {
        "fingerprint": "scr_3e134ef2968fce94",
        "screen_name": "Explore Products",
        "category": "product_checkout",
        "purpose": "Allows users to view and interact with Explore Products features including 'Search smart gadgets..., Home, Cart (0)'.",
        "elements_count": 12,
        "activity_name": "com.revrag.sampleapp.HomeActivity"
      },
      {
        "fingerprint": "scr_6aca5b4a33df7673",
        "screen_name": "Flagship ANC Smart Headset",
        "category": "settings",
        "purpose": "Provides system and application configuration controls for Flagship ANC Smart Headset.",
        "elements_count": 5,
        "activity_name": "com.revrag.sampleapp.Product_detailActivity"
      },
      {
        "fingerprint": "scr_1c60c85364a6ca89",
        "screen_name": "Alex Agent",
        "category": "identity_verification",
        "purpose": "Collects verification identity information for user compliance (Alex Agent).",
        "elements_count": 6,
        "activity_name": "com.revrag.sampleapp.ProfileActivity"
      }
    ],
    "edges": [
      {
        "from_fingerprint": "scr_5b353a89a14fed38",
        "to_fingerprint": "scr_c0c416f5fba65fa1",
        "action_type": "tap",
        "target_element_id": "btn_get_started",
        "reason": "Explore interactive element btn_get_started"
      },
      {
        "from_fingerprint": "scr_c0c416f5fba65fa1",
        "to_fingerprint": "scr_c0c416f5fba65fa1",
        "action_type": "input_text",
        "target_element_id": "edit_phone",
        "reason": "Auto-fill test phone number for login"
      },
      {
        "from_fingerprint": "scr_c0c416f5fba65fa1",
        "to_fingerprint": "scr_c0c416f5fba65fa1",
        "action_type": "input_text",
        "target_element_id": "edit_otp",
        "reason": "Auto-fill test OTP for verification"
      },
      {
        "from_fingerprint": "scr_c0c416f5fba65fa1",
        "to_fingerprint": "scr_3e134ef2968fce94",
        "action_type": "tap",
        "target_element_id": "btn_login_submit",
        "reason": "Submit authentication or KYC form"
      },
      {
        "from_fingerprint": "scr_3e134ef2968fce94",
        "to_fingerprint": "scr_3e134ef2968fce94",
        "action_type": "input_text",
        "target_element_id": "edit_search_bar",
        "reason": "Fill editable field edit_search_bar"
      },
      {
        "from_fingerprint": "scr_3e134ef2968fce94",
        "to_fingerprint": "scr_6aca5b4a33df7673",
        "action_type": "tap",
        "target_element_id": "card_product_1",
        "reason": "Explore interactive element card_product_1"
      },
      {
        "from_fingerprint": "scr_6aca5b4a33df7673",
        "to_fingerprint": "scr_3e134ef2968fce94",
        "action_type": "tap",
        "target_element_id": "btn_back",
        "reason": "Explore interactive element btn_back"
      },
      {
        "from_fingerprint": "scr_3e134ef2968fce94",
        "to_fingerprint": "scr_6aca5b4a33df7673",
        "action_type": "tap",
        "target_element_id": "card_product_2",
        "reason": "Explore interactive element card_product_2"
      },
      {
        "from_fingerprint": "scr_6aca5b4a33df7673",
        "to_fingerprint": "scr_6aca5b4a33df7673",
        "action_type": "tap",
        "target_element_id": "btn_add_to_cart",
        "reason": "Explore interactive element btn_add_to_cart"
      },
      {
        "from_fingerprint": "scr_6aca5b4a33df7673",
        "to_fingerprint": "scr_3e134ef2968fce94",
        "action_type": "back",
        "target_element_id": null,
        "reason": "Backtrack to explore unvisited branches"
      },
      {
        "from_fingerprint": "scr_3e134ef2968fce94",
        "to_fingerprint": "scr_3e134ef2968fce94",
        "action_type": "tap",
        "target_element_id": "nav_home",
        "reason": "Explore interactive element nav_home"
      },
      {
        "from_fingerprint": "scr_3e134ef2968fce94",
        "to_fingerprint": "scr_3e134ef2968fce94",
        "action_type": "tap",
        "target_element_id": "nav_cart",
        "reason": "Explore interactive element nav_cart"
      },
      {
        "from_fingerprint": "scr_3e134ef2968fce94",
        "to_fingerprint": "scr_1c60c85364a6ca89",
        "action_type": "tap",
        "target_element_id": "nav_profile",
        "reason": "Explore interactive element nav_profile"
      },
      {
        "from_fingerprint": "scr_1c60c85364a6ca89",
        "to_fingerprint": "scr_3e134ef2968fce94",
        "action_type": "tap",
        "target_element_id": "btn_back_profile",
        "reason": "Explore interactive element btn_back_profile"
      },
      {
        "from_fingerprint": "scr_3e134ef2968fce94",
        "to_fingerprint": "scr_c0c416f5fba65fa1",
        "action_type": "back",
        "target_element_id": null,
        "reason": "Backtrack to explore unvisited branches"
      },
      {
        "from_fingerprint": "scr_c0c416f5fba65fa1",
        "to_fingerprint": "scr_3e134ef2968fce94",
        "action_type": "tap",
        "target_element_id": "btn_skip_login",
        "reason": "Explore interactive element btn_skip_login"
      }
    ],
    "entry_node": "scr_5b353a89a14fed38",
    "journeys": [
      {
        "journey_name": "Path to Welcome Back - Login",
        "step_count": 2,
        "screen_sequence": [
          "scr_5b353a89a14fed38",
          "scr_c0c416f5fba65fa1"
        ],
        "description": "Navigation journey leading to Authenticates the user into the application using mobile, email, or credentials (Welcome Back - Login)."
      },
      {
        "journey_name": "Path to Explore Products",
        "step_count": 3,
        "screen_sequence": [
          "scr_5b353a89a14fed38",
          "scr_c0c416f5fba65fa1",
          "scr_3e134ef2968fce94"
        ],
        "description": "Navigation journey leading to Allows users to view and interact with Explore Products features including 'Search smart gadgets..., Home, Cart (0)'."
      },
      {
        "journey_name": "Path to Flagship ANC Smart Headset",
        "step_count": 4,
        "screen_sequence": [
          "scr_5b353a89a14fed38",
          "scr_c0c416f5fba65fa1",
          "scr_3e134ef2968fce94",
          "scr_6aca5b4a33df7673"
        ],